{"format":"pddlica-plan","horizon":"4.0","metadata":{"extensions":{},"producer":"pddlica-hybrid-milp","producer_version":"0.1.0"},"model_digest":"sha256:2b3e4f1f4d265d608638321d1bfa011ea2c85a22ec992e4d21e3492a1be9cdf3","occurrences":[{"arguments":[],"id":"milp/1","kind":"method","name":"calibrate","owner":["mission","camera"],"schema_id":"domain/component/camera/method/calibrate","time":"0.0"},{"arguments":[],"id":"milp/2","kind":"method","name":"begin-image","owner":["mission","camera"],"schema_id":"domain/component/camera/method/begin-image","time":"1.0"},{"arguments":[],"id":"milp/3","kind":"method","name":"transmit-image","owner":["mission","camera"],"schema_id":"domain/component/camera/method/transmit-image","time":"3.0"}],"version":"0.1"}