{"format":"pddlica-plan","version":"0.1","model_digest":"","horizon":"1.1",
 "occurrences":[{"id":"occ/0","time":"0","kind":"method","schema_id":"domain/component/match/method/ignite","name":"ignite","owner":["match-1"],"arguments":[]}],
 "metadata":{"producer":"example","producer_version":"0.1.0","extensions":{}}}
