{"format":"pddlica-plan","version":"0.1","model_digest":"","horizon":"2",
 "occurrences":[
  {"id":"occ/0","time":"0","kind":"method","schema_id":"domain/component/worker/method/start","name":"start","owner":["left"],"arguments":[]},
  {"id":"occ/1","time":"0","kind":"method","schema_id":"domain/component/worker/method/start","name":"start","owner":["right"],"arguments":[]}],
 "metadata":{"producer":"example","producer_version":"0.1.0","extensions":{}}}
