{
  "format": "pddlica-plan",
  "version": "0.1",
  "model_digest": "",
  "horizon": "5",
  "occurrences": [
    {
      "id": "occ/0",
      "time": "0",
      "kind": "method",
      "schema_id": "domain/component/pump/method/switch-on",
      "name": "switch-on",
      "owner": ["transfer"],
      "arguments": []
    }
  ],
  "metadata": {"producer": "example", "producer_version": "0.1.0", "extensions": {}}
}
