{"format":"pddlica-plan","horizon":"4.0","metadata":{"extensions":{},"producer":"pddlica-hybrid-milp","producer_version":"0.1.0"},"model_digest":"sha256:2c299bf001998f95ffd515edbc0ee0899f2628275040b2c516fa9844674402e7","occurrences":[{"arguments":[],"id":"milp/1","kind":"method","name":"open","owner":["plant","transfer"],"schema_id":"domain/component/valve/method/open","time":"0.0"}],"version":"0.1"}