{"format":"pddlica-plan","horizon":"2.0","metadata":{"extensions":{},"producer":"pddlica-hybrid-milp","producer_version":"0.1.0"},"model_digest":"sha256:caff42494422ec62142002cd6943c934d04bacac03d2ab32e60b0ea5fc3b1878","occurrences":[{"arguments":[],"id":"milp/1","kind":"method","name":"turn-on","owner":["site","heater-a"],"schema_id":"domain/component/heater/method/turn-on","time":"0.0"},{"arguments":[],"id":"milp/2","kind":"method","name":"turn-on","owner":["site","heater-b"],"schema_id":"domain/component/heater/method/turn-on","time":"0.0"}],"version":"0.1"}