{"format":"pddlica-plan","version":"0.1","model_digest":"","horizon":"3",
 "occurrences":[{"id":"occ/0","time":"0","kind":"method","schema_id":"domain/component/job/method/admit","name":"admit","owner":["important"],"arguments":[]}],
 "metadata":{"producer":"example","producer_version":"0.1.0","extensions":{}}}
